{
  "$schema": "http://json-schema.org/draft-07/schema#",
  "$id": "home-agent.capability-catalog/v1",
  "title": "Home Agent capability catalog",
  "type": "object",
  "required": [
    "schema",
    "source",
    "summary",
    "capabilities"
  ],
  "properties": {
    "schema": {
      "const": "home-agent.capability-catalog/v1"
    },
    "generated_by": {
      "type": "string"
    },
    "generated_at": {
      "type": "string"
    },
    "source": {
      "type": "object",
      "required": [
        "repo",
        "edge"
      ],
      "properties": {
        "repo": {
          "type": "string"
        },
        "commit": {
          "type": "string"
        },
        "edge": {
          "type": "string"
        },
        "live_source": {
          "type": "string"
        },
        "live_count": {
          "type": "integer"
        }
      }
    },
    "summary": {
      "type": "object"
    },
    "services": {
      "type": "array",
      "items": {
        "type": "object",
        "required": [
          "service_id"
        ],
        "properties": {
          "service_id": {
            "type": "string"
          },
          "display_name": {
            "type": "string"
          },
          "group": {
            "type": "string"
          },
          "version": {
            "type": "string"
          },
          "constant": {
            "type": "string"
          },
          "capabilities": {
            "type": "array",
            "items": {
              "type": "string"
            }
          }
        }
      }
    },
    "capabilities": {
      "type": "array",
      "items": {
        "type": "object",
        "required": [
          "capability_id",
          "kind",
          "composition",
          "group"
        ],
        "properties": {
          "capability_id": {
            "type": "string"
          },
          "kind": {
            "type": "string",
            "enum": [
              "input",
              "action",
              "output",
              "system",
              ""
            ]
          },
          "composition": {
            "type": "string",
            "enum": [
              "atomic",
              "composite"
            ]
          },
          "role": {
            "type": "string"
          },
          "definition": {
            "type": "object",
            "description": "代码决定的定义层（稳定）"
          },
          "live": {
            "type": "object",
            "description": "此刻广告出去的实况层（含 providers）"
          },
          "planner_recognize": {
            "type": "string"
          },
          "typical_triggers": {
            "type": "array",
            "items": {
              "type": "string"
            }
          },
          "do_not_dispatch": {
            "type": "array",
            "items": {
              "type": "string"
            }
          },
          "decomposes_to": {
            "type": "array",
            "items": {
              "type": "string"
            }
          },
          "prefer_when": {
            "type": "string"
          },
          "group": {
            "type": "string"
          },
          "display_name": {
            "type": "string"
          },
          "input_schema": {
            "type": "object"
          },
          "output_schema": {
            "type": "object"
          },
          "declared_by": {
            "type": "array",
            "items": {
              "type": "string"
            }
          },
          "packages": {
            "type": "array",
            "items": {
              "type": "string"
            }
          },
          "docs": {
            "type": "array",
            "items": {
              "type": "string"
            }
          },
          "entry": {
            "type": "object"
          },
          "config_keys": {
            "type": "array",
            "items": {
              "type": "string"
            }
          },
          "availability": {
            "type": "object",
            "properties": {
              "has_checker": {
                "type": "boolean"
              },
              "live": {
                "type": "boolean"
              }
            }
          },
          "providers": {
            "type": "array",
            "items": {
              "type": "object"
            }
          },
          "registered_ids": {
            "type": "array",
            "items": {
              "type": "string"
            }
          },
          "in_ads": {
            "type": "boolean"
          },
          "in_live": {
            "type": "boolean"
          },
          "reconcile": {
            "type": "object"
          }
        }
      }
    }
  }
}
