{
  "schema": "home-agent.capability-catalog/v1",
  "generated_by": "mac/scripts/export_capability_catalog.py",
  "generated_at": "2026-10-11T00:59:11Z",
  "source": {
    "repo": "home-agent-capabilty-marketplace",
    "commit": "",
    "edge": "marketplace",
    "seeded_from": "home-agent-os 6084fe0 (one-time bootstrap; do not re-export from os)"
  },
  "summary": {
    "capabilities": 62,
    "ads_definitions": 62,
    "declared_capabilities": 56,
    "services": 40,
    "extensions": 34,
    "with_checker": 13,
    "brain_wire": 57,
    "groups": {
      "aquarium": 1,
      "asset": 2,
      "camera": 4,
      "chat": 1,
      "climate": 1,
      "clock": 1,
      "convert": 5,
      "display": 6,
      "document": 2,
      "experiment": 1,
      "game": 2,
      "light": 1,
      "lock": 1,
      "map": 1,
      "math": 1,
      "meta": 1,
      "music": 8,
      "network": 2,
      "notify": 3,
      "ocr": 1,
      "phone": 1,
      "printer": 1,
      "pronunciation": 1,
      "query": 1,
      "read": 1,
      "reading": 4,
      "search": 1,
      "speaker": 2,
      "video": 1,
      "vision": 2,
      "voice": 2
    },
    "kinds": {
      "action": 36,
      "input": 10,
      "output": 12,
      "system": 4
    }
  },
  "services": [
    {
      "constant": "CHROMECAST_DISPLAY_SERVICE",
      "service_id": "chromecast.display",
      "display_name": "Chromecast Cast",
      "group": "display",
      "version": "0.4.0",
      "capabilities": [
        "display.photo",
        "display.slideshow"
      ]
    },
    {
      "constant": "",
      "service_id": "chromecast.game",
      "display_name": "",
      "group": "",
      "version": "",
      "capabilities": [
        "game.launch"
      ],
      "source": "brain.wire"
    },
    {
      "constant": "",
      "service_id": "document.scanner",
      "display_name": "",
      "group": "",
      "version": "",
      "capabilities": [
        "document.scan",
        "visual.input"
      ],
      "source": "brain.wire"
    },
    {
      "constant": "ENTRY_LOCK_SERVICE",
      "service_id": "entry.lock",
      "display_name": "小米门锁",
      "group": "lock",
      "version": "0.1.0",
      "capabilities": [
        "lock.status"
      ]
    },
    {
      "constant": "GOPRO_CAMERA_SERVICE",
      "service_id": "gopro.camera",
      "display_name": "GoPro Camera",
      "group": "camera",
      "version": "0.9.0",
      "capabilities": [
        "camera.capture",
        "camera.capture_and_upload"
      ]
    },
    {
      "constant": "",
      "service_id": "iphone.game.input",
      "display_name": "",
      "group": "",
      "version": "",
      "capabilities": [
        "game.input"
      ],
      "source": "brain.wire"
    },
    {
      "constant": "",
      "service_id": "iphone.video",
      "display_name": "",
      "group": "",
      "version": "",
      "capabilities": [
        "video.live_stream"
      ],
      "source": "brain.wire"
    },
    {
      "constant": "LIVINGROOM_AQUARIUM_SERVICE",
      "service_id": "livingroom.aquarium",
      "display_name": "米家智能鱼缸",
      "group": "aquarium",
      "version": "0.1.0",
      "capabilities": [
        "aquarium.set"
      ]
    },
    {
      "constant": "LIVINGROOM_LIGHT_SERVICE",
      "service_id": "livingroom.ceiling_light",
      "display_name": "客厅大路灯",
      "group": "light",
      "version": "0.1.1",
      "capabilities": [
        "light.set"
      ]
    },
    {
      "constant": "LIVINGROOM_CLIMATE_SERVICE",
      "service_id": "livingroom.climate",
      "display_name": "客厅海信空调",
      "group": "climate",
      "version": "0.1.0",
      "capabilities": [
        "climate.set"
      ]
    },
    {
      "constant": "LOCAL_ASSET_SERVICE",
      "service_id": "local.asset",
      "display_name": "Local Asset",
      "group": "asset",
      "version": "0.3.0",
      "capabilities": [
        "asset.upload"
      ]
    },
    {
      "constant": "LOCAL_CHARACTER_SERVICE",
      "service_id": "local.character",
      "display_name": "Local Character Reading",
      "group": "reading",
      "version": "0.3.0",
      "capabilities": [
        "reading.detect_finger",
        "reading.ocr_at_finger",
        "reading.point_to_character",
        "reading.rank_pointed"
      ]
    },
    {
      "constant": "LOCAL_CHAT_SERVICE",
      "service_id": "local.chat",
      "display_name": "Local Chat",
      "group": "chat",
      "version": "0.1.0",
      "capabilities": [
        "chat.smalltalk"
      ]
    },
    {
      "constant": "LOCAL_CLOCK_SERVICE",
      "service_id": "local.clock",
      "display_name": "Local Clock",
      "group": "clock",
      "version": "0.1.1",
      "capabilities": [
        "clock.now"
      ]
    },
    {
      "constant": "LOCAL_FILE_CONVERT_SERVICE",
      "service_id": "local.file.convert",
      "display_name": "文件格式转换器",
      "group": "convert",
      "version": "0.1.0",
      "capabilities": [
        "file.convert"
      ]
    },
    {
      "constant": "LOCAL_MATH_SERVICE",
      "service_id": "local.math",
      "display_name": "Local Math",
      "group": "math",
      "version": "0.1.0",
      "capabilities": [
        "math.calculate"
      ]
    },
    {
      "constant": "LOCAL_NOTIFY_SERVICE",
      "service_id": "local.notify",
      "display_name": "Local Notify",
      "group": "notify",
      "version": "0.1.1",
      "capabilities": [
        "notify.speak"
      ]
    },
    {
      "constant": "LOCAL_PAPER_READ_SERVICE",
      "service_id": "local.paper.read",
      "display_name": "论文听读器",
      "group": "read",
      "version": "0.1.0",
      "capabilities": [
        "paper.read"
      ]
    },
    {
      "constant": "LOCAL_PDF_IMAGES_SERVICE",
      "service_id": "local.pdf.images",
      "display_name": "PDF 页面渲染器",
      "group": "convert",
      "version": "0.1.0",
      "capabilities": [
        "pdf.to_images"
      ]
    },
    {
      "constant": "LOCAL_PDF_READER_SERVICE",
      "service_id": "local.pdf.reader",
      "display_name": "PDF 语音朗读器",
      "group": "convert",
      "version": "0.1.0",
      "capabilities": [
        "pdf.reader"
      ]
    },
    {
      "constant": "LOCAL_PDF_ROTATE_SERVICE",
      "service_id": "local.pdf.rotate",
      "display_name": "PDF 旋转器",
      "group": "convert",
      "version": "0.1.0",
      "capabilities": [
        "pdf.rotate"
      ]
    },
    {
      "constant": "LOCAL_PRINTER_SERVICE",
      "service_id": "local.printer",
      "display_name": "米家喷墨一体机",
      "group": "printer",
      "version": "0.1.0",
      "capabilities": [
        "printer.print"
      ]
    },
    {
      "constant": "LOCAL_PRONUNCIATION_SERVICE",
      "service_id": "local.pronunciation",
      "display_name": "Local Pronunciation Assessment",
      "group": "pronunciation",
      "version": "0.1.0",
      "capabilities": [
        "pronunciation.assess"
      ]
    },
    {
      "constant": "LOCAL_QUERY_SERVICE",
      "service_id": "local.query",
      "display_name": "Local Query",
      "group": "query",
      "version": "0.2.1",
      "capabilities": [
        "query.content"
      ]
    },
    {
      "constant": "LOCAL_SEARCH_SERVICE",
      "service_id": "local.search",
      "display_name": "Web Image Search",
      "group": "search",
      "version": "0.1.0",
      "capabilities": [
        "search.images"
      ]
    },
    {
      "constant": "LOCAL_VISION_SERVICE",
      "service_id": "local.vision",
      "display_name": "Local Vision",
      "group": "vision",
      "version": "0.5.0",
      "capabilities": [
        "vision.ask",
        "vision.perceive"
      ]
    },
    {
      "constant": "LOCAL_VOICE_SERVICE",
      "service_id": "local.voice",
      "display_name": "Local Voice Stream",
      "group": "voice",
      "version": "0.2.0",
      "capabilities": [
        "voice.stream",
        "voicewakeup.echo"
      ]
    },
    {
      "constant": "LOCAL_VOICE_TEST_SERVICE",
      "service_id": "local.voice_test",
      "display_name": "台灯语音控制实验",
      "group": "experiment",
      "version": "0.1.0",
      "capabilities": [
        "voice_test.run_trial"
      ]
    },
    {
      "constant": "LOCAL_WEB_SCRAPER_SERVICE",
      "service_id": "local.web.scraper",
      "display_name": "网页抓取器",
      "group": "convert",
      "version": "0.1.0",
      "capabilities": [
        "web.scraper"
      ]
    },
    {
      "constant": "GAME_HOST_SERVICE",
      "service_id": "mac.game.host",
      "display_name": "Mac Game Host",
      "group": "game",
      "version": "0.1.0",
      "capabilities": [
        "game.launch"
      ]
    },
    {
      "constant": "",
      "service_id": "marshall.willen",
      "display_name": "",
      "group": "",
      "version": "",
      "capabilities": [
        "bluetooth.connect",
        "bluetooth.disconnect"
      ],
      "source": "brain.wire"
    },
    {
      "constant": "MUSIC_RECOGNIZE_SERVICE",
      "service_id": "music.recognize",
      "display_name": "识曲（听歌识曲）",
      "group": "music",
      "version": "0.1.0",
      "capabilities": [
        "music.recognize"
      ]
    },
    {
      "constant": "NETEASE_MUSIC_SERVICE",
      "service_id": "netease.music",
      "display_name": "网易云音乐",
      "group": "music",
      "version": "0.5.0",
      "capabilities": [
        "music.cache",
        "music.next",
        "music.pause",
        "music.play",
        "music.previous",
        "music.resume",
        "music.stop"
      ]
    },
    {
      "constant": "",
      "service_id": "system.asset",
      "display_name": "",
      "group": "",
      "version": "",
      "capabilities": [
        "asset.inventory"
      ],
      "source": "brain.wire"
    },
    {
      "constant": "",
      "service_id": "system.capabilities",
      "display_name": "",
      "group": "",
      "version": "",
      "capabilities": [
        "capabilities.summary"
      ],
      "source": "brain.wire"
    },
    {
      "constant": "",